{
 "schema": "lifesavinglab.bundle.v1",
 "task_id": "leeway-values-piw-raft",
 "preamble_version": "1.2",
 "contributor": {"handle": "agent-nine", "agent": "Claude Fable 5.1 (claude-fable-5-1)"},
 "status": "not-found",
 "rows": [],
 "corrections": [],
 "evidence": [
  {"url": "https://apps.dtic.mil/sti/pdfs/ADA366414.pdf", "quote": "Recommended Leeway Speed and Direction Values for Search Planning Tools 8-5", "where": "List of Tables, p. xxv, entry for Table 8-1 (gives the table title and page 8-5). The fetched text of this PDF ends at page 3-2, so the table body itself was not read."},
  {"url": "https://apps.dtic.mil/sti/pdfs/ADA366414.pdf", "quote": "8.3 RECOMMENDATIONS FOR LEEWAY GUIDANCE FOR THE MANUAL METHOD 8-4", "where": "Table of Contents, p. xi (chapter 8 runs 8-1 to 8-14; 8.4 Future Work starts 8-14, so section 8.3 with Table 8-1 occupies pages 8-4 to 8-13)."},
  {"url": "https://apps.dtic.mil/sti/pdfs/ADA366414.pdf", "quote": "Sixty-three new leeway classes and their values are recommended for inclusion in the next version of the National SAR Manual.", "where": "Executive Summary, Question 9, p. vii."},
  {"url": "https://apps.dtic.mil/sti/pdfs/ADA366414.pdf", "quote": "The values for the leeway equations are presented in Appendix B.", "where": "Executive Summary, Question 9, p. vii. List of Tables p. xxvi also lists 'B-1 Cross-Reference of Leeway Drift Objects B1-1'."},
  {"url": "https://apps.dtic.mil/sti/pdfs/ADA366414.pdf", "quote": "Sixty-three search object leeway classes and their leeway speed coefficients and divergence angles are recommended", "where": "Abstract on the Report Documentation Page, p. iii (Report No. CG-D-08-99, April 1999, Arthur A. Allen and Jeffery V. Plourde, USCG R&D Center, Groton CT)."},
  {"url": "https://archive.org/details/DTIC_ADA366414", "quote": "DTIC ADA366414: Review of Leeway: Field Experiments and Implementation", "where": "Item page title; item dated 1999-04-01, 351 pages, lists DTIC_ADA366414_djvu.txt (568.8K OCR full text) and DTIC_ADA366414.pdf (13.8M). The text file itself could not be opened (see tried)."},
  {"url": "https://ntrl.ntis.gov/NTRL/dashboard/searchResults/titleDetail/ADA435435.xhtml", "quote": "Leeway Divergence.", "where": "NTRL title-detail page: author Allen, A. A.; Coast Guard Research and Development Center, Groton, CT; 2005; 128 pages; accession ADA435435. Download control is a form button, no direct PDF URL."},
  {"url": "https://ntrl.ntis.gov/NTRL/dashboard/searchResults/titleDetail/ADA366414.xhtml", "quote": "Fundamental shortfalls in our understanding of leeway drift behavior", "where": "NTRL title-detail page, first words of the abstract; authors A. A. Allen and J. V. Plourde, 1999, 351 pages."}
 ],
 "tried": [
  "Opened https://apps.dtic.mil/sti/pdfs/ADA366414.pdf with WebFetch: the converted text is 88,845 characters and stops at page 3-2 (Table 3-1); offsets 88000 and 88800 return only the tail ('... 0.8 to 16.7 3-2 100'), so Table 8-1 (p. 8-5) and Appendix B are beyond what the tool can read.",
  "DTIC alternative paths for the 1999 report: https://apps.dtic.mil/sti/tr/pdf/ADA366414.pdf, https://apps.dtic.mil/sti/citations/ADA366414, https://apps.dtic.mil/sti/html/tr/ADA366414/index.html, https://www.dtic.mil/dtic/tr/fulltext/u2/a366414.pdf: fetch error or robots-disallowed each time.",
  "2005 report (Allen, Leeway Divergence, DTIC ADA435435): https://apps.dtic.mil/sti/pdfs/ADA435435.pdf, /sti/tr/pdf/ADA435435.pdf, /sti/citations/ADA435435, /sti/citations/tr/ADA435435, /sti/html/tr/ADA435435/index.html: all fetch errors (two attempts on the first, minutes apart). DTIC itself was reachable: /sti/pdfs/ADA366414.pdf and /sti/pdfs/ADA252345.pdf (Spring 1985 Leeway Experiment) opened.",
  "Other USCG leeway reports on DTIC that might carry the same object classes: ADA363933 (search hit for the Table 8-1 caption wording, title unverified), ADA338829 (Leeway of an Open Boat and Three Life Rafts in Heavy Weather), ADA376479, ADA020977, ADA526782: fetch errors on both /sti/pdfs/ and /sti/tr/pdf/ paths.",
  "Internet Archive copy (full OCR text exists, 568.8K): https://archive.org/stream/DTIC_ADA366414/DTIC_ADA366414_djvu.txt, https://archive.org/download/DTIC_ADA366414/DTIC_ADA366414_djvu.txt, https://archive.org/download/DTIC_ADA366414, https://archive.org/details/DTIC_ADA366414/DTIC_ADA366414_djvu.txt and https://archive.org/details/DTIC_ADA435435: each needed a permission that was not answered in time, so the fetch was refused (blocked URLs). Searches for a search-engine-listed copy of the text file found none.",
  "Wayback Machine copies of the DTIC OAI records (web.archive.org): site blocked. http://oai.dtic.mil OAI record: robots disallowed. ResearchGate pages for the 1999 report and for 'The Leeway of Persons-In-Water and Three Small Craft': fetch error. Google Books entry for Leeway Divergence (id JRnojwEACAAJ): 'No eBook available'.",
  "USCG SAR Addendum COMDTINST M16130.2F (https://www.dco.uscg.mil/Portals/9/CG-5R/manuals/COMDTINST%20M16130.2F.pdf) lists 'Table H-7 Leeway Speed and Direction Values for Drift Objects' at H-28 and 'Table H-7a Sub-Table for Maritime Life Rafts with Deep Ballast Systems and Canopies' at H-30, but the fetch reads only the first 120,510 characters (ends at PPO-10), so H-28 is unreachable the same way.",
  "Checked for a reproduction of the table in peer-reviewed/co-authored papers (not usable as rows anyway): Breivik, Allen, Maisondieu, Roth 2011 (archimer 12152.pdf) and Breivik & Allen 2008 (arXiv 1111.1102) give no per-class values; met.no report 17/2010 gives only its own 2009 field regressions. OpenDrift docs point to OBJECTPROP.DAT, a secondary copy.",
  "Searches for mirrors (docplayer, studylib, scribd, HathiTrust, Semantic Scholar, CORE, archimer, uscg.mil, us.archive.org) and for the phrases 'Recommended Leeway Speed and Direction Values' and 'Full text of DTIC ADA366414': no readable copy. No Chrome browser was connected (list_connected_browsers returned empty), so the archive.org viewer could not be opened interactively. The shell was not used for the web, as instructed."
 ],
 "notes": "No row recorded: none of the Table 8-1 values could be read from the report itself, and the rules forbid working from memory or from secondary copies. What was verified in the primary source (DTIC PDF, first 88,845 characters): the report is CG-D-08-99, April 1999, Allen and Plourde, USCG R&D Center; Table 8-1 is titled 'Recommended Leeway Speed and Direction Values for Search Planning Tools' and starts on page 8-5, inside section 8.3 'Recommendations for Leeway Guidance for the Manual Method' (pp. 8-4 to 8-13); the Executive Summary (p. vii) says 63 new leeway classes are recommended and that 'the values for the leeway equations are presented in Appendix B' (Table B-1 'Cross-Reference of Leeway Drift Objects', p. B1-1). So a reader needs pages 8-4 to 8-13 and Appendix B; the table may span several pages. Table 2-3 (pp. 2-8 to 2-11, 'Objects that have been field tested for leeway values') names the object classes the task lists (PIW (65 kg); PIW vertical with PFD; Switlik and Avon 4-person and Tulmar 4-person life rafts; Switlik 6-person raft; 12 ft Silver Skiff; 5.6 m open plank boat; Sea Kayak; Surfboards (Chapline 1960); Wind-surfer board) but carries no leeway values. Why it stopped: the fetch tool converts only the first part of any PDF (88,845 characters here; 100,111 and 120,510 for two other PDFs, so the cap is on file size or pages, not characters), and every other route to the later pages failed: DTIC's newer /sti/tr/pdf/ and citation paths error out, the 2005 report is not served at any DTIC path tried, and the Internet Archive's OCR text file (which exists, 568.8K) needed a permission nobody could answer in time. The 2005 'equivalent' (Allen, Leeway Divergence, CG-D-05-05, DTIC ADA435435, 128 pages) is listed by NTRL and Google Books but no readable copy was reachable. Suggested fixes for a rerun: add the archive.org full-text URL (https://archive.org/stream/DTIC_ADA366414/DTIC_ADA366414_djvu.txt) to the task inputs so it has provenance, or have a person download it and paste pages 8-4 to 8-13; or obtain the 2005 report through the NTRL download button. Also worth knowing: the Coast Guard's current table is Table H-7 (p. H-28) of the SAR Addendum COMDTINST M16130.2F (2013), which postdates both reports and may differ from Table 8-1; record which edition any value comes from. The context row hf-radar-search-area was not touched: nothing opened here bears on it.",
 "next_tasks": [
  {"title": "Read Table 8-1 (pp. 8-4 to 8-13) and Appendix B from the archive.org OCR text of DTIC ADA366414", "why": "The full text exists (568.8K) but the fetch needed a permission that was not answered; a person can approve it or paste the pages."},
  {"title": "Obtain Allen (2005) Leeway Divergence, CG-D-05-05 (ADA435435), via the NTRL download", "why": "It is the 2005 equivalent named in the task and no DTIC path served it; NTRL lists it with a download button."},
  {"title": "Record Table H-7 and H-7a (pp. H-28 to H-30) of the USCG SAR Addendum COMDTINST M16130.2F", "why": "It is the Coast Guard's current leeway table (2013); values should be compared with Table 8-1, not merged with it."},
  {"title": "Identify DTIC ADA363933 and ADA338829 and read their own leeway tables for PIW, skiff, kayak, surfboard and 4-6 person rafts", "why": "Both are USCG R&D Center field reports behind the Table 8-1 classes; their pages failed to open here but are primary."}
 ]
}
